{
  "schema_version": "v2-online-response/v2",
  "reader_version": "v2-online-reader/v2",
  "outcome": "FACTUAL_OPTIONS",
  "query_digest": "sha256:aaaaaaaaaaaaaaaaaaaaaaaaaaaaaaaaaaaaaaaaaaaaaaaaaaaaaaaaaaaaaaaa",
  "reason_codes": [
    "factual_options_only",
    "product_quality_not_claimed",
    "buy_wait_not_calibrated"
  ],
  "items": [
    {
      "entity_ref": "variant:42",
      "offer_ref": "offer:77",
      "name": "Smartphone Exemple 128 Go",
      "brand": "Exemple",
      "image_url": "https://assets.example.test/phone.jpg",
      "merchant": "Marchand Exemple",
      "merchant_ref": "merchant:12",
      "price": {"amount": "599.00", "currency": "EUR"},
      "availability": "in_stock",
      "observed_at": "2026-09-07T08:00:00+00:00",
      "destination_url": "https://merchant.example.test/product/77",
      "ranking_basis": "retrieval_and_hard_constraints_only",
      "unknowns": [
        "shipping_cost",
        "delivery_time",
        "returns",
        "cashback",
        "product_quality",
        "buy_wait"
      ],
      "evidence_refs": [
        "offer:77:price",
        "offer:77:stock",
        "product-ontology:42:lexical"
      ]
    }
  ],
  "provenance": [
    {"stage": "hybrid_retrieval", "result_digest": "sha256:bbbbbbbbbbbbbbbbbbbbbbbbbbbbbbbbbbbbbbbbbbbbbbbbbbbbbbbbbbbbbbbb"},
    {"stage": "constraint_engine", "result_digest": "sha256:cccccccccccccccccccccccccccccccccccccccccccccccccccccccccccccccc"},
    {"stage": "product_ranking", "result_digest": "sha256:dddddddddddddddddddddddddddddddddddddddddddddddddddddddddddddddd"},
    {"stage": "offer_optimization", "result_digest": "sha256:eeeeeeeeeeeeeeeeeeeeeeeeeeeeeeeeeeeeeeeeeeeeeeeeeeeeeeeeeeeeeeee"},
    {"stage": "confidence", "result_digest": "sha256:ffffffffffffffffffffffffffffffffffffffffffffffffffffffffffffffff"},
    {"stage": "buy_wait", "result_digest": "sha256:1111111111111111111111111111111111111111111111111111111111111111"}
  ],
  "raw_query_retained": false
}
